Company_Symbol,Company_name,Trading name,Sector,Industry_Group,PRICE,CHANGE,PREV. CLOSE,OPEN,HIGH,LOW,NO. OF TRADES,AVG. TRADE SIZE,VOLUME TRADED,VALUE_TRADED_SAR,ANNOUNCEMENTS,ANNOUNCEMENTS_Date,Scraping_date
2270,Saudia Dairy and Foodstuff Co.,SADAFCO,Consumer Staples,Food & Beverages,167.20,-0.4,167.60,168.00,168.00,165.20,227,56,"12,815","2,138,050.20","Saudia Dairy and Foodstuff Co. (""SADAFCO"") announces to Invites its Shareholders to Attend the ( First Meeting ) Extraordinary General Assembly Meeting",2021-10-24,2021-12-12
1120,Al Rajhi Bank,ALRAJHI,Financials,Banks,134.80,-1.0,135.80,136.20,137.60,133.80,"7,901",324,"2,556,101","347,184,024.80",Al Rajhi Bank announces its Interim Financial Results for the Period Ending on 2021-09-30 ( Nine Months ),2021-10-24,2021-12-12
2210,Nama Chemicals Co.,NAMA CHEMICALS,Materials,Materials,34.40,0.50,33.90,34.10,34.50,33.90,596,537,"320,303","10,943,463.95",Addendum Announcement from Nama Chemicals Co. in regards the announcement of the opening of candidacy for membership the Board Of Directors,2021-10-24,2021-12-12
2350,Saudi Kayan Petrochemical Co.,SAUDI KAYAN,Materials,Materials,17.00,-0.2,17.28,17.40,17.46,16.84,"6,509",984,"6,407,600","109,192,156.84",Saudi Kayan Petrochemical Co.  announces its Interim Financial Results for the Period Ending on 2021-09-30 ( Nine Months ),2021-10-24,2021-12-12
2210,Nama Chemicals Co.,NAMA CHEMICALS,Materials,Materials,34.40,0.50,33.90,34.10,34.50,33.90,596,537,"320,303","10,943,463.95",Nama Chemicals Company announces the safe completion of the scheduled periodic maintenance works for the plants of Hassad project (Subsidiary Plant),2021-10-24,2021-12-12
1301,United Wire Factories Co.,ASLAK,Materials,Materials,30.70,-0.4,31.10,31.10,31.10,30.50,649,308,"200,175","6,151,311.65",United Wire Factories Co. announces signing a Memorandum of Understanding with Themar for  Food and Catering Company (Limited Liability Company),2021-10-24,2021-12-12
3060,Yanbu Cement Co.,YCC,Materials,Materials,37.00,-0.2,37.25,37.35,37.40,36.95,335,514,"172,220","6,405,539.05",Correction announcement from Yanbu cement co. in regards to the Interim Financial Results for the period Ended on 30-09-2021 (Nine months),2021-10-24,2021-12-12
4004,Dallah Healthcare Co.,DALLAH HEALTH,Health Care,Health Care Equipment & Svc,74.10,0.40,73.70,73.50,74.20,73.30,413,239,"98,908","7,296,053.00",Dallah Healthcare Company announces obtaining of a Long Term Murabaha Financing in compliance with Islamic Sharia,2021-10-24,2021-12-12
1180,The Saudi National Bank,SNB,Financials,Banks,62.20,0.00,62.20,62.10,62.50,61.50,"1,849",815,"1,507,678","93,261,240.40",The Saudi National Bank announces its Interim Financial Results for the Period Ending on 2021-09-30 ( Nine Months ),2021-10-24,2021-12-12
7202,Arabian Internet and Communications Services Co.,SOLUTIONS,Information Technology,Software & Services,181.00,1.60,179.40,179.40,183.00,178.40,"2,558",62,"157,578","28,467,034.40",Arabian Internet and Telecommunication Company (solutions) announces signing contracts with (stc) (Related Party),2021-10-24,2021-12-12
4310,Knowledge Economic City,KEC,Real Estate,Real Estate Mgmt & Dev't,17.32,-0.2,17.56,17.52,17.56,17.00,"1,739",645,"1,121,289","19,337,208.56",Addendum Announcement to the Knowledge Economic City announcement regarding the Signing of SAR782 Million Financing Agreement with the Saudi Tourism Development Fund and Riyad Bank to Finance the Execution of Knowledge Economic City Hub Project,2021-10-24,2021-12-12
7010,Saudi Telecom Co.,STC,Communication Services,Telecommunication Services,110.00,-2.0,112.00,112.20,113.00,110.00,"7,167",321,"2,298,648","255,167,924.20",Saudi Telecom Company (stc) announces its interim condensed consolidated financial results for the period ending on 30-09-2021 (Nine Months),2021-10-21,2021-12-12
2380,Rabigh Refining and Petrochemical Co.,PETRO RABIGH,Energy,Energy,21.54,-0.2,21.76,21.76,21.92,21.20,"6,109",675,"4,126,335","88,778,147.16","Rabigh Refining and Petrochemical Co. (Petro Rabigh) Announces the Results of the Ordinary General Assembly Meeting, ( First Meeting )",2021-10-21,2021-12-12
2270,Saudia Dairy and Foodstuff Co.,SADAFCO,Consumer Staples,Food & Beverages,167.20,-0.4,167.60,168.00,168.00,165.20,227,56,"12,815","2,138,050.20",Saudia Dairy and Foodstuff Co.  announces its Interim Financial Results for the Period Ending on 2021-09-30 ( Six Months ),2021-10-21,2021-12-12
4150,Arriyadh Development Co.,ARDCO,Real Estate,Real Estate Mgmt & Dev't,26.35,-0.2,26.55,26.55,26.80,26.35,620,418,"259,195","6,878,941.35",Arriyadh Development Co.  announces its Interim Financial Results for the Period Ending on 2021-09-30 ( Nine Months ),2021-10-21,2021-12-12
4336,Mulkia Gulf Real Estate REIT,MULKIA REIT,Real Estate,REITs,9.82,0.01,9.81,9.76,9.82,9.76,117,305,"35,631","348,808.56",Addendum announcement from Mulkia Investment Company related to cash dividend distributions to the Unitholders of Mulkia Gulf Real Estate REIT fund,2021-10-21,2021-12-12
4012,Thob Al Aseel Co.,ALASEEL,Consumer Discretionary,Consumer Durables & Apparel,50.30,-0.6,50.90,50.80,51.10,49.50,617,152,"93,930","4,742,500.75",Addendum Announcement from Thob Al Aseel Co. in regards to Invites its shareholders to attend the Extraordinary General Assembly Meeting (the first meeting) which includes the capital increase through modern technology,2021-10-21,2021-12-12
2030,Saudi Arabia Refineries Co.,SARCO,Energy,Energy,141.60,-0.4,142.00,142.40,144.00,139.00,"4,245",164,"694,137","97,931,284.80",Corrective announcement from the Saudi Arabian Refineries Company regarding the announcement of administrative changes in the executive management,2021-10-21,2021-12-12
2030,Saudi Arabia Refineries Co.,SARCO,Energy,Energy,141.60,-0.4,142.00,142.40,144.00,139.00,"4,245",164,"694,137","97,931,284.80",Saudi Arabian Refineries Company (SARCO) announces administrative changes in the executive management,2021-10-21,2021-12-12
7010,Saudi Telecom Co.,STC,Communication Services,Telecommunication Services,110.00,-2.0,112.00,112.20,113.00,110.00,"7,167",321,"2,298,648","255,167,924.20",Saudi Telecom Company (stc) announces the interim dividends for the 3rd quarter 2021,2021-10-21,2021-12-12
3060,Yanbu Cement Co.,YCC,Materials,Materials,37.00,-0.2,37.25,37.35,37.40,36.95,335,514,"172,220","6,405,539.05",Yanbu cement co. announces the annual consolidated financial results for the period ended on 30-09-2021 (Nine months),2021-10-21,2021-12-12
2320,Al-Babtain Power and Telecommunication Co.,ALBABTAIN,Industrials,Capital Goods,32.40,0.05,32.35,32.40,32.60,32.20,439,378,"165,833","5,372,687.30",Al Babtain Power and Telecommunication company announces obtaining Bank Financing through medium- term Islamic Murabaha Finance.,2021-10-21,2021-12-12
4160,Thimar Development Holding Co.,THIMAR,Consumer Staples,Food & Staples Retailing,-,0.00,17.20,N/A,-,-,0,0,0,0.00,The National Agricultural Marketing Company (Thimar) announces the signing of a framework agreement with Al-Khair Financial Company  (Al Khair Capital),2021-10-20,2021-12-12
4160,Thimar Development Holding Co.,THIMAR,Consumer Staples,Food & Staples Retailing,-,0.00,17.20,N/A,-,-,0,0,0,0.00,Addendum announcement from the National Agricultural Marketing Company - Thimar - regarding the opening of the financial reorganization procedures,2021-10-20,2021-12-12
1030,Saudi Investment Bank,SAIB,Financials,Banks,17.56,-0.1,17.70,17.58,17.76,17.56,262,829,"217,294","3,834,071.54","The Saudi Investment Bank announces its intention to redeem its outstanding SAR 500,000,000 Additional Tier 1 Capital Sukuk on the First Call Date",2021-10-20,2021-12-12
2330,Advanced Petrochemical Co.,ADVANCED,Materials,Materials,68.00,-1.3,69.30,69.50,69.50,68.00,"1,742",192,"335,225","23,018,020.50",ADVANCED PETROCHEMICAL COMPANY ANNOUNCES THE DISTRIBUTION OF DIVIDEND FOR THE THIRD QUARTER OF 2021,2021-10-20,2021-12-12
4100,Makkah Construction and Development Co.,MCDC,Real Estate,Real Estate Mgmt & Dev't,74.10,-0.2,74.30,74.00,75.90,73.50,419,200,"83,629","6,232,604.90",Makkah Construction and Development Co.  announces its Interim Financial Results for the Period Ending on 30/01/1443H ( Nine Months ),2021-10-20,2021-12-12
2310,Sahara International Petrochemical Co.,SIPCHEM,Materials,Materials,40.60,-1.3,41.90,42.10,42.15,40.40,"4,223",678,"2,861,548","117,430,298.85",Sahara International Petrochemical Company (Sipchem) announces the Interim Financial Results for the Period Ending on 30 September 2021 (Nine Months),2021-10-20,2021-12-12
7202,Arabian Internet and Communications Services Co.,SOLUTIONS,Information Technology,Software & Services,181.00,1.60,179.40,179.40,183.00,178.40,"2,558",62,"157,578","28,467,034.40",Arabian Internet and Communications Services Co.  announces its Interim Financial Results for the Period Ending on 2021-09-30 ( Nine Months ),2021-10-19,2021-12-12
4160,Thimar Development Holding Co.,THIMAR,Consumer Staples,Food & Staples Retailing,-,0.00,17.20,N/A,-,-,0,0,0,0.00,The National Agricultural Marketing Company announces the resignation of its CEO,2021-10-19,2021-12-12
4009,Middle East Healthcare Co.,SAUDI GERMAN HEALTH,Health Care,Health Care Equipment & Svc,32.80,0.05,32.75,32.70,33.05,32.55,540,325,"175,588","5,750,056.60","Correction announcement from Middle East Healthcare Co. in regards to the company announcement about the latest developments regarding the signing of a memorandum of understanding to enter as an investor partner At Sobhi Abdel Jalil Batterjee Medical Hospital, located in Jeddah",2021-10-19,2021-12-12
4340,Al Rajhi REIT Fund,Al RAJHI REIT,Real Estate,REITs,11.34,0.00,11.34,11.34,11.34,11.32,394,151,"59,655","675,921.60",Addendum Announcement from Al Rajhi Capital  Regarding a material development related to Al Rajhi REIT Fund.,2021-10-19,2021-12-12
3020,Yamama Cement Co.,YSCC,Materials,Materials,26.70,-0.2,26.90,27.10,27.10,26.55,512,394,"201,940","5,423,525.60",Yamama Cement Co.  announces its Interim Financial Results for the Period Ending on 2021-09-30 ( Nine Months ),2021-10-19,2021-12-12
2040,Saudi Ceramic Co.,SAUDI CERAMICS,Industrials,Capital Goods,52.70,-0.8,53.50,53.40,53.60,52.70,"1,092",288,"314,154","16,667,199.30",Saudi Ceramic Co.  announces its Interim Financial Results for the Period Ending on 2021-09-30 ( Nine Months ),2021-10-18,2021-12-12
2340,Al Abdullatif Industrial Investment Co.,ALABDULLATIF,Consumer Discretionary,Consumer Durables & Apparel,31.00,-0.2,31.20,31.20,31.55,30.25,"1,428",353,"503,721","15,565,708.90",Al Abdullatif Industrial Investment Co. Announces Calling Candidature for Board Members Elections,2021-10-18,2021-12-12
2290,Yanbu National Petrochemical Co.,YANSAB,Materials,Materials,64.00,0.00,64.00,64.00,64.70,63.50,"1,430",236,"337,523","21,560,498.00",Yanbu National Petrochemical Co.  announces its Interim Financial Results for the Period Ending on 2021-09-30 ( Nine Months ),2021-10-18,2021-12-12
2300,Saudi Paper Manufacturing Co.,SPM,Materials,Materials,50.90,-0.9,51.80,51.90,51.90,50.10,646,221,"142,965","7,290,438.60",Saudi Paper Manufacturing Co. Announces the Board's Recommendation to Increase the Capital by Offering Right Issues,2021-10-18,2021-12-12
7200,Al Moammar Information Systems Co.,MIS,Information Technology,Software & Services,139.80,-3.2,143.00,144.20,145.80,139.60,"2,480",176,"435,475","62,082,639.60",Al Moammar Information Systems Co. (MIS) Announces an update on company Announcement regarding the timetable to the announcement of Financial results,2021-10-18,2021-12-12
4009,Middle East Healthcare Co.,SAUDI GERMAN HEALTH,Health Care,Health Care Equipment & Svc,32.80,0.05,32.75,32.70,33.05,32.55,540,325,"175,588","5,750,056.60",".Middle East Healthcare Company (Saudi German Hospital) Announcement About the latest developments regarding the signing of a memorandum of understanding to enter as an investor partner At Sobhi Abdel Jalil Batterjee Medical Hospital, located in Jeddah",2021-10-17,2021-12-12
2050,Savola Group,SAVOLA GROUP,Consumer Staples,Food & Beverages,33.35,0.45,32.90,33.05,33.35,32.75,"1,636",382,"625,778","20,655,461.05","The Savola Group Announces that its subsidiary, Savola Foods Company, completed the acquisition of Bayara Holding Limited.",2021-10-17,2021-12-12
3008,Al Kathiri Holding Co.,ALKATHIRI,Materials,Materials,74.70,1.20,73.50,73.60,75.40,73.00,"1,374",236,"324,021","24,167,263.30",Al Kathiri Holding Co. Announces that one of its subsidiaries has received a land allocated for the construction of a concrete manufacturing plant in Al-Narges View Project in Al-Jawan Suburb from Abdul Rahman Saad Al Rashed & Sons Co.,2021-10-17,2021-12-12
4020,Saudi Real Estate Co.,ALAKARIA,Real Estate,Real Estate Mgmt & Dev't,21.86,-0.2,22.10,22.22,22.32,21.72,"1,345",522,"701,865","15,429,021.74",Saudi Real Estate Co. Announces Calling Candidature for Board Members Elections,2021-10-17,2021-12-12
4337,SICO Saudi REIT Fund,SICO SAUDI REIT,Real Estate,REITs,9.01,-0.0,9.02,9.04,9.06,9.00,242,"1,306","316,067","2,851,102.28",Announcement from Muscat Capital company Regarding the Availability of the Quarterly Statement of Al-Mashaar REIT Fund for the Period Ended 30 September 2021,2021-10-17,2021-12-12
8160,Arabia Insurance Cooperative Co.,AICC,Financials,Insurance,38.85,0.15,38.70,38.70,39.25,38.40,247,545,"134,523","5,242,930.30",Arabia Insurance Cooperative Co. Invites its Shareholders to Attend the Extraordinary General Assembly Meeting for Capital Increase ( First Meeting ) by Means of Modern Technology.,2021-10-17,2021-12-12
2140,AYYAN Investment Co.,AYYAN,Health Care,Health Care Equipment & Svc,20.44,-0.1,20.54,20.54,20.70,20.30,665,491,"326,757","6,704,089.64",Ayyan Investment Company Invites its Shareholders to Attend the Extraordinary General Assembly Meeting for Capital Increase (Third Meeting) through means of modern technology,2021-10-17,2021-12-12
4200,Aldrees Petroleum and Transport Services Co.,ALDREES,Energy,Energy,68.80,0.80,68.00,68.30,69.00,68.30,679,231,"156,618","10,763,168.60",Aldrees Petroleum and Transport Services Co.(ALDREES)  announces its Interim Financial Results for the Period Ending on 2021-09-30 ( Nine Months ),2021-10-17,2021-12-12
8270,Buruj Cooperative Insurance Co.,BURUJ,Financials,Insurance,24.86,0.08,24.78,24.78,24.98,24.52,188,433,"81,399","2,014,022.16",Buruj Cooperative Insurance Co. Announces Calling Candidature for Board Members Elections,2021-10-17,2021-12-12
1830,Leejam Sports Co.,FITNESS TIME,Consumer Discretionary,Consumer Services,107.00,-2.2,109.20,109.40,111.40,107.00,"1,568",190,"297,701","32,380,068.60",Leejam Sports Company (Fitness Time) Announces the Results of The Ordinary General Assembly Meeting (First Meeting),2021-10-17,2021-12-12
4348,Alkhabeer REIT Fund,ALKHABEER REIT,Real Estate,REITs,8.61,0.01,8.60,8.62,8.65,8.61,404,416,"168,188","1,451,208.63","Announcement by Alkhabeer Capital for the availability of the quarterly statement report of Alkhabeer REIT fund for the period ending on September 30, 2021.",2021-10-14,2021-12-12
8210,Bupa Arabia for Cooperative Insurance Co.,BUPA ARABIA,Financials,Insurance,133.40,-2.2,135.60,135.80,135.80,133.00,874,54,"47,179","6,323,687.40",BUPA ARABIA FOR COOPERATIVE INSURANCE CO. INVITES ITS SHAREHOLDERS TO ATTEND THE EXTRAORDINARY GENERAL ASSEMBLY MEETING (FIRST MEETING) THROUGH MODERN TECHNOLOGY MEANS,2021-10-14,2021-12-12
4342,Jadwa REIT Saudi Fund,JADWA REIT SAUDI,Real Estate,REITs,15.58,-0.3,15.88,15.60,15.60,15.54,180,234,"42,073","656,710.12",Jadwa Investment Company announces the availability of the quarterly fact sheet for Jadwa REIT Saudi Fund for the period ending on 30 September 2021,2021-10-14,2021-12-12
3001,Hail Cement Co.,HCC,Materials,Materials,14.34,0.00,14.34,14.42,14.44,14.24,"1,721",817,"1,405,762","20,123,236.16",Hail Cement Co. announces to Invites its Shareholders to Attend the ( First Meeting ) Ordinary General Assembly Meeting,2021-10-14,2021-12-12
4346,MEFIC REIT Fund,MEFIC REIT,Real Estate,REITs,7.15,-0.0,7.16,7.16,7.16,7.10,465,416,"193,661","1,381,289.92","MEFIC Capital announces the availability of MEFIC REIT Fund quarterly report for quarter 3, 2021.",2021-10-14,2021-12-12
4347,Bonyan REIT Fund,BONYAN REIT,Real Estate,REITs,10.00,-0.0,10.04,10.00,10.00,9.99,130,890,"115,638","1,155,823.03",Announcement by Saudi Fransi Capital for the Availability of the quarterly statement of Bonyan REIT Fund for the period ending on 30/09/2021.,2021-10-14,2021-12-12
4334,AL Maather REIT Fund,AL MAATHER REIT,Real Estate,REITs,8.85,0.03,8.82,8.82,8.85,8.82,208,431,"89,580","791,412.57",OSOOL & BAKHEET INVESTMENT COMPANY announces the availability of the Quarterly report for Al Maather REIT as of 30/09/2021,2021-10-14,2021-12-12
2140,AYYAN Investment Co.,AYYAN,Health Care,Health Care Equipment & Svc,20.44,-0.1,20.54,20.54,20.70,20.30,665,491,"326,757","6,704,089.64",Ayyan Investment Company Announces the Non convenience of its Extraordinary General Assembly’s Meeting that included the Company's capital Increase (First Meeting and the Second Meeting one hour after the first),2021-10-14,2021-12-12
4340,Al Rajhi REIT Fund,Al RAJHI REIT,Real Estate,REITs,11.34,0.00,11.34,11.34,11.34,11.32,394,151,"59,655","675,921.60",Al Rajhi Capital announces the availability of quarterly statement for Al Rajhi REIT Fund for the period ended 30th September 2021,2021-10-14,2021-12-12
6001,Halwani Bros. Co.,HB,Consumer Staples,Food & Beverages,88.70,-3.3,92.00,93.40,94.00,88.70,"1,118",114,"127,628","11,621,706.70","Halwani Bros. Co. Announces the Results of the Ordinary General Assembly Meeting, (First Meeting)",2021-10-14,2021-12-12
4020,Saudi Real Estate Co.,ALAKARIA,Real Estate,Real Estate Mgmt & Dev't,21.86,-0.2,22.10,22.22,22.32,21.72,"1,345",522,"701,865","15,429,021.74",Saudi Real Estate Co. Announces Contract Sign Off with Diriyah Gate Development Authority,2021-10-14,2021-12-12
4333,Taleem REIT Fund,TALEEM REIT,Real Estate,REITs,12.98,0.12,12.86,12.84,13.20,12.82,291,243,"70,599","917,659.04",Announcement by Saudi Fransi Capital for the Availability of the quarterly statement of Taleem REIT Fund for the period ending on 30/09/2021.,2021-10-14,2021-12-12
4339,Derayah REIT Fund,DERAYAH REIT,Real Estate,REITs,13.20,0.00,13.20,13.20,13.20,13.18,266,236,"62,782","828,204.44",Derayah Financial Releases Q3 2021 Report for Derayah REIT,2021-10-14,2021-12-12
4332,Jadwa REIT Al Haramain Fund,JADWA REIT ALHARAMAIN,Real Estate,REITs,8.49,0.15,8.34,8.36,8.49,8.32,274,705,"193,141","1,620,137.36",Jadwa Investment Company announces the availability of the quarterly fact sheet for Jadwa REIT Al Haramain Fund for the period ending on 30 September 2021,2021-10-14,2021-12-12
4336,Mulkia Gulf Real Estate REIT,MULKIA REIT,Real Estate,REITs,9.82,0.01,9.81,9.76,9.82,9.76,117,305,"35,631","348,808.56",Mulkia Investment Company announces the availability of Mulkia Gulf Real Estate REIT Fund quarterly statement for the period ending 30 September 2021,2021-10-13,2021-12-12
4335,Musharaka REIT Fund,MUSHARAKA REIT,Real Estate,REITs,9.85,-0.0,9.90,9.91,9.91,9.83,304,"1,002","304,641","3,007,651.59",Musharaka Capital announces the Availability of the Quarterly Statement for Musharaka REIT Fund for the period ending on 30 September 2021,2021-10-13,2021-12-12
4331,AlJazira REIT,ALJAZIRA REIT,Real Estate,REITs,22.16,0.20,21.96,21.94,23.10,21.86,"1,048",349,"365,983","8,219,999.70",Al-Jazira Capital announces the availability of the quarterly statement of Al-Jazira REIT Fund for the period ending on 09-30-2021AD,2021-10-13,2021-12-12
4020,Saudi Real Estate Co.,ALAKARIA,Real Estate,Real Estate Mgmt & Dev't,21.86,-0.2,22.10,22.22,22.32,21.72,"1,345",522,"701,865","15,429,021.74",Saudi Real Estate Co. Announces an update on  The rescheduling of the Public Investment  Fund (PIF) loan,2021-10-13,2021-12-12
4334,AL Maather REIT Fund,AL MAATHER REIT,Real Estate,REITs,8.85,0.03,8.82,8.82,8.85,8.82,208,431,"89,580","791,412.57",OSOOL & BAKHEET INVESTMENT COMPANY Announces the Occurrence of Specific Event to AL Maather REIT Fund,2021-10-13,2021-12-12
4342,Jadwa REIT Saudi Fund,JADWA REIT SAUDI,Real Estate,REITs,15.58,-0.3,15.88,15.60,15.60,15.54,180,234,"42,073","656,710.12",Corrective Announcement from Jadwa Investment Company Regarding,2021-10-12,2021-12-12
4210,Saudi Research and Media Group,SRMG,Communication Services,Media and Entertainment,166.00,-1.2,167.20,167.00,167.80,165.60,394,108,"42,630","7,086,953.80",Saudi Research and Media Group Announces the Conclusion of Acquisition of Thmanyah Company for Publishing and Distribution,2021-10-12,2021-12-12
4342,Jadwa REIT Saudi Fund,JADWA REIT SAUDI,Real Estate,REITs,15.58,-0.3,15.88,15.60,15.60,15.54,180,234,"42,073","656,710.12",Jadwa Investment Company Announces the Results of the Subscription in the Increasing of the Total Asset Value of Jadwa REIT Saudi Fund,2021-10-12,2021-12-12
2190,Saudi Industrial Services Co.,SISCO,Industrials,Transportation,31.70,0.10,31.60,31.60,32.05,31.30,"2,891",676,"1,955,022","61,914,654.20",Saudi Industrial Services Co. announces to Invites its Shareholders to Attend the ( First Meeting ) Ordinary General Assembly Meeting,2021-10-12,2021-12-12
4345,Swicorp Wabel REIT Fund,SWICORP WABEL REIT,Real Estate,REITs,7.17,0.02,7.15,7.16,7.20,7.10,658,736,"484,237","3,465,728.36",Announcement by Swicorp for the Availability of the quarterly statement of Swicorp Wabel REIT Fund for the Period Ending on 30 September 2021,2021-10-12,2021-12-12
4338,AlAhli REIT Fund 1,ALAHLI REIT 1,Real Estate,REITs,12.34,-0.0,12.36,12.40,12.40,12.30,114,743,"84,685","1,043,912.18",Announcement by SNB Capital Company regarding the Availability of AlAhli REIT Fund (1) Quarterly Fact Sheet for the period ended 30 September 2021,2021-10-12,2021-12-12
8100,Saudi Arabian Cooperative Insurance Co.,SAICO,Financials,Insurance,22.24,0.00,22.24,22.20,22.50,22.12,458,883,"404,567","8,995,305.02",Saudi Arabian Cooperative Insurance Company announces signing Bancassurance agreement with AlRajhi Bank,2021-10-11,2021-12-12
1202,Middle East Paper Co.,MEPCO,Materials,Materials,45.15,-0.7,45.90,45.90,45.95,44.60,778,324,"252,329","11,428,951.90",Middle East Paper Co. Announces renewal and amendment banking facility agreement (Shariah-compliant) with Bank Albilad.,2021-09-07,2021-12-12
2320,Al-Babtain Power and Telecommunication Co.,ALBABTAIN,Industrials,Capital Goods,32.40,0.05,32.35,32.40,32.60,32.20,439,378,"165,833","5,372,687.30",Al Babtain Power and Telecommunication company announces obtaining Bank Financing through medium- term Islamic Murabaha Finance.,2021-10-11,2021-12-12
4003,United Electronics Co.,EXTRA,Consumer Discretionary,Retailing,131.40,-1.6,133.00,133.00,133.60,130.00,698,118,"82,218","10,838,691.00",United Electronics Company (Extra) announces the Estimated financial results for the period ending on 30-9-2021 (Nine Months),2021-10-11,2021-12-12
2280,Almarai Co.,ALMARAI,Consumer Staples,Food & Beverages,48.65,0.15,48.50,48.40,48.65,48.10,873,190,"166,100","8,031,269.60",Almarai Company Announces Its Condensed Consolidated Interim Financial Results for The Period Ended on 30th September 2021 (Nine Months),2021-10-10,2021-12-12
4005,National Medical Care Co.,CARE,Health Care,Health Care Equipment & Svc,64.50,-0.6,65.10,65.00,66.40,64.50,492,160,"78,480","5,124,099.70",The National Medical Care Company announces the latest developments of its contract with Tabrak Najd Contracting Company.,2021-10-10,2021-12-12
4336,Mulkia Gulf Real Estate REIT,MULKIA REIT,Real Estate,REITs,9.82,0.01,9.81,9.76,9.82,9.76,117,305,"35,631","348,808.56",Mulkia Investment Company announces dividends distribution to Mulkia Gulf Real Estate REIT Unitholders,2021-10-10,2021-12-12
8012,Aljazira Takaful Taawuni Co.,JAZIRA TAKAFUL,Financials,Insurance,22.04,-0.0,22.12,22.06,22.34,21.82,"1,323",539,"712,537","15,721,052.90",Aljazira Takaful Taawuni Company. Announces signing an agreement with Bank Aljazira (Related Party),2021-10-10,2021-12-12
2330,Advanced Petrochemical Co.,ADVANCED,Materials,Materials,68.00,-1.3,69.30,69.50,69.50,68.00,"1,742",192,"335,225","23,018,020.50",ADVANCED PETROCHEMICAL COMPANY ANNOUNCES THE ESTIMATED FINANCIAL RESULTS FOR THE PERIOD ENDED ON 30 SEPTEMBER 2021 (NINE MONTHS),2021-10-10,2021-12-12
4320,Alandalus Property Co.,ALANDALUS,Real Estate,Real Estate Mgmt & Dev't,18.32,0.10,18.22,18.22,18.60,18.20,763,633,"483,344","8,867,660.80",Al-Andalus Property Co. announces the BOD’s recommendation to distribute dividends to shareholders for first half of 2021,2021-10-10,2021-12-12
8300,Wataniya Insurance Co.,WATANIYA,Financials,Insurance,44.45,0.05,44.40,44.20,45.25,44.05,"2,543",160,"408,024","18,223,991.05",Correction announcement from Wataniya Insurance Co. in regards to the start of the nomination period for the election of the Board of Directors for a new term of three years,2021-10-10,2021-12-12
1030,Saudi Investment Bank,SAIB,Financials,Banks,17.56,-0.1,17.70,17.58,17.76,17.56,262,829,"217,294","3,834,071.54",The Saudi Investment Bank Announces Calling Candidature for Board Members Elections,2021-10-10,2021-12-12
8012,Aljazira Takaful Taawuni Co.,JAZIRA TAKAFUL,Financials,Insurance,22.04,-0.0,22.12,22.06,22.34,21.82,"1,323",539,"712,537","15,721,052.90",Aljazira Takaful Taawuni Company. Announces signing an agreement with Bank Aljazira (Related Party),2021-10-07,2021-12-12
2190,Saudi Industrial Services Co.,SISCO,Industrials,Transportation,31.70,0.10,31.60,31.60,32.05,31.30,"2,891",676,"1,955,022","61,914,654.20",Saudi Industrial Services Co. (SISCO) Announces new five-year strategy to drive growth,2021-10-07,2021-12-12
4338,AlAhli REIT Fund 1,ALAHLI REIT 1,Real Estate,REITs,12.34,-0.0,12.36,12.40,12.40,12.30,114,743,"84,685","1,043,912.18",Announcement by SNB Capital Company regarding an update of the terms and conditions of AlAhli REIT Fund (1),2021-10-07,2021-12-12
